date,headline
2025-04-07,Markets are crashing. Bitcoin at 75k
2025-04-05,"Bitcoin shows signs of decoupling from US equities, could reclaim $100K"
2025-04-04,The future of DeFi isn’t on Ethereum — it’s on Bitcoin
2025-04-03,Analyst Warns of Massive Ethereum Drop Against Bitcoin
2025-04-03,Ethereum faces a storm: Could the crypto giant plummet by 91%?
2025-04-03,Trader Says Ethereum Headed for a Massive Crash Against Bitcoin As Bearish Pattern Forms – Here’s His Outlook
2025-04-02,Analyst Benjamin Cowen warns Ethereum could drop another 50%
2025-04-01,GameStop Completes $1.5 Billion Offering to Fund Bitcoin Reserve
2025-04-01,"Ethereum prints 4 consecutive red monthly candles, but data points to an ETH/BTC bottom"
2025-04-01,Mastercard Plans to Enable 3.5 Billion Cardholders to Transact with Bitcoin ($BTC) and Crypto
2025-03-31,U.S. Senator Buys $600K in Bitcoin via ETF
2025-03-31,Ethereum-Bitcoin Ratio Drops To Five-Year Low
2025-03-31,Trump’s sons to launch American Bitcoin
2025-03-31,"Strategy announces another purchase of 22,048 BTC"
2025-03-31,Bukele May Visit Trump as Bitcoin Goals Align
2025-03-30,"Hoskinson Reveals Cardano’s Push to Integrate with Dogecoin, Chainlink, Bitcoin"
2025-03-28,Ethereum Crashes 74% Against Bitcoin; Is Reversal Imminent?
2025-03-28,Permissionless Bitcoin Debuts on Solana With Zeus Network’s $zBTC
2025-03-27,US States Push Bitcoin Bills to Boost Reserves and Crypto Mining
2025-03-26,XRP ETF Incoming? Analyst Says Ripple’s Legal Win Changes Everything
2025-03-23,Michael Saylor hints at new Bitcoin purchase after $711M capital raise
2025-03-23,"IMF Adds Bitcoin to Reserves, Tracks It as Digital Gold and Capital Asset"
2025-03-22,"Senator Lummis Proposes U.S. Sell Gold to Buy 200,000 Bitcoin Annually for Five Years, Totaling 1 Million Bitcoin"
2025-03-20,Michael Saylor says Europe’s Euro is ‘gonna need BTC’
2025-03-20,"Staking for ether ETFs gathers steam as BlackRock talks up potential, NYSE files on behalf of Bitwise fund"
2025-03-20,Bitcoin could thrive in a U.S. recession: BlackRock
2025-03-18,XRP Stumbles—But Analysts Still See A Path To $70
2025-03-18,"Trump administration wants to buy as much Bitcoin as possible, Crypto Council’s Bo Hines reveals"
2025-03-18,"Bitcoin Pepe thrives as risk aversion hurts Bitcoin, Dogecoin"
2025-03-18,Strategy Announces New Preferred Stock Offering to Fund Bitcoin Purchases
2025-03-18,Global Crackdown on Bitcoin ATMs Gains Momentum
2025-03-17,Kentucky Passes Bill Protecting Bitcoin Self-Custody and Mining
2025-03-17,Most US Voters Oppose Trump’s National Bitcoin Reserve Plan
2025-03-16,Trump-backed World Liberty Financial buys AVAX and MNT for $4M as total portfolio losses reach $118M
2025-03-13,Trump Admin Wants to Acquire as Much Bitcoin as Possible: White House
2025-03-12,Bitcoin Surges to $82K Amid SEC’s ETF Delays and Lummis’ Bitcoin Reserve Plans
2025-03-11,Bitcoin and Crypto About To Be Boosted by Global Money Supply Explosion: Former Goldman Sachs Executive
2025-03-08,"U.S banks can now legally handle crypto and stablecoins, says OCC"
2025-03-07,"Bitcoin Price Crash Incoming? Why A Fall To $63,000 Is Possible If This Resistance Holds"
2025-03-07,Trump’s Treasury Secretary Scott Bessent says Bitcoin acquisition plans are in discussion
2025-03-07,Trump Signs Executive Order to Create Bitcoin Strategic Reserve
2025-03-05,"US Government Will Only Buy Bitcoin, Not ETH, XRP, SOL and ADA"
2025-03-05,ADA and LINK Steal the Show as BTC Eyes $90K (Market Watch)
2025-03-04,"Bitcoin analysts set recovery roadmap from the crash up to $150,000"
2025-03-04,"El Salvador buys Bitcoin dip, adding 5 BTC amid price plunge to $83,000"
2025-03-03,"Bitcoin Open Interest Crashed To 6-Month Low, Here’s What Followed The Last Time"
2025-03-03,Why XRP and ADA don’t deserve to be on Trump’s Strategic Crypto Reserve
2025-03-03,Bitcoin Price Surges Nearly 10% to $95K as Trump’s Crypto Policies Boost Market Confidence
2025-03-02,"President Trump Reveals U.S. Crypto Reserve Bombshell — Sending BTC, ETH, Ripple’s XRP, Solana, And Cardano Rocketing"
2025-03-02,"MICHAEL SAYLOR: ""Bitcoin is the foundation of the crypto economy."""
2025-03-02,"Bitcoin Will Explode Over $120,000 on Monday as ETF Demand Skyrockets Amid Trump’s BTC Reserve Announcement"
2025-03-02,"Breaking: Trump Announces U.S. Crypto Strategic Reserve Including XRP, SOL, ADA, BTC, and ETH"
2025-03-02,Trump says Bitcoin and Ethereum will be included in US crypto reserve
2025-03-02,"Trump directs working group to ‘move forward’ on SOL, XRP, and ADA Crypto Strategic Reserve"
2025-03-02,El Salvador continues to buy the Bitcoin dip adding to its National Reserve
2025-02-28,Texas Governor’s Office Issues Statement on Bitcoin Reserve Bill After Committee Approval
2025-02-28,Bitcoin Legislation Advances: Arizona Moves Closer to Crypto Reserves
2025-02-28,"Texas Bitcoin Reserve Bill Advances, Faces Senate Vote"
2025-02-27,"Bitcoin Poised to Rebound Above $105,000 in March as Trump Delays Tariffs Until April"
2025-02-25,Cathie Wood Says Bitcoin Consolidation Extremely Healthy Amid ‘Early Stages’ of Institutional Adoption: Report
2025-02-25,Strategy Makes Largest Bitcoin Purchase of 2025 with $2B Investment
2025-02-25,GOP Divisions Threaten State-Level Bitcoin Reserve Bills
2025-02-20,Are XRP and DOGE Preparing for 25% Price Moves?
2025-02-20,Cardano vs Ethereum
2025-02-19,World’s first XRP spot ETF to debut on Brazil’s leading stock exchange
2025-02-19,Strategy Plans $2B Stock Sale to Buy More Bitcoin
2025-02-17,"XRP Set To Outshine Gold? Analyst Predicts 1,000% Surge"
2025-02-17,"Banking Giant JPMorgan Chase Holds $1,016,728 in Bitcoin and Ethereum ETFs, According to New SEC Filing"
2025-02-17,"$ETH ""Fun"" Fact:

If ETH were to still trade at the same ETH/BTC ratio as it did after the FTX Collapse &amp; 2022 Bear Market Bottom, it would now be valued at $7K+.

That's if it just kept up with $BTC's pace."
2025-02-17,Abu Dhabi’s Mubadala Invests $436M in BlackRock’s Bitcoin ETF
2025-02-15,Abu Dhabi’s Sovereign Wealth Fund Boosts Bitcoin Exposure with BlackRock ETF
2025-02-14,"Ethereum ‘Attractive’ Against Bitcoin at Current Level, Says Analyst Benjamin Cowen – Here’s His Outlook"
2025-02-14,Wisconsin doubles down on BlackRock’s Bitcoin ETF with $321 million investment
2025-02-14,Abu Dhabi sovereign wealth fund steps into Bitcoin with a $436M ETF investment
2025-02-14,"GameStop Considers Bitcoin Investment, Stock Surges on Speculation"
2025-02-14,"Billions in Bitcoin and Ethereum Options Expire, Market Braces for Volatility"
2025-02-13,Trump Swaps BTC-e Founder Vinnik for U.S. Teacher in Russia Deal
2025-02-11,"BREAKING: 🇺🇸 Fed Chair Powell says he is ""struck"" by the growing number of cases of de-banked Bitcoin and crypto firms and he is ""determined to take a fresh look at that."""
2025-02-11,JUST IN: 🇨🇭The Swiss creator of ProtonMail launches a #Bitcoin wallet that's opensource and self-custody to its 100 million customers.
2025-02-11,ADA outperforms Bitcoin as Grayscale seeks approval for first US Cardano ETF in SEC filing
2025-02-11,Strategy Resumes Bitcoin Buying After Rebrand
2025-02-11,Japan May Approve Bitcoin ETFs and Cut Crypto Taxes
2025-02-10,North Carolina becomes 20th US state to introduce legislation for a Bitcoin reserve
2025-02-10,Wall Street’s Ethereum Short Bets Explode – Should Investors Worry?
2025-02-10,Hong Kong Approves Bitcoin and Ethereum for Investment Immigration
2025-02-10,University of Austin Invests in Bitcoin as Endowments Turn to Crypto
2025-02-09,"XRP Set for All-Time Highs if Weekly Close Tops This Level, Says Crypto Analyst"
2025-02-08,"Ripple’s XRP Prepping For Ultra Bullish 1,500% Breakout As Spot XRP ETFs Gain Major Traction"
2025-02-06,Czech Republic Passes Law: No Bitcoin Tax After 3 Years!
2025-02-06,Czech President Petr Pavel Signs Law Eliminating Capital Gains Tax on Bitcoin for HODLERS After 3+ Years
2025-02-06,"MicroStrategy Becomes Strategy, Invests $20B in Bitcoin Amid Rebrand"
2025-02-05,Trump’s Crypto Czar Explores Strategic Bitcoin Reserve
2025-02-05,Earn $ADA Cashback with Yoroi Desktop Extension
2025-02-05,"David Sacks Pushes Bitcoin Reserve, Stablecoin Bill in Crypto Plan"
2025-02-04,Trump's Sovereign Wealth Fund: A Big Deal for Crypto?
2025-02-04,Utah Leads Race to Become First US State with Bitcoin Reserve
2025-02-04,"MicroStrategy Halts Bitcoin Buying Streak, Sparks Speculation"
2025-02-03,El Salvador Buys More Bitcoin While Adjusting Policies for IMF
2025-02-03,More Parents Choose Bitcoin Over 529 College Savings Plans
2025-02-02,"Vitalik Buterin Rejects Bitcoin Allocation Rule, Stays Committed to Ethereum"
2025-02-01,Satoshi Nakamoto’s First Bitcoin Website Revealed From Past: Details
2025-02-01,Bitcoin’s Next Rally Around the Corner as Stablecoin Liquidity Expands: CryptoQuant
2025-02-01,European Central Bank president: Bitcoin lacks reserve potential
2025-01-31,Texas to Prioritize Bitcoin Reserve in 2025
2025-01-31,"Robert Kiyosaki Ditches Gold and Silver, Goes All-In on Bitcoin"
2025-01-31,"Tether Brings USDT to Bitcoin’s Lightning Network for Faster, Cheaper Payments"
2025-01-30,US SEC approves Bitwise’s combined Bitcoin and Ethereum ETF
2025-01-30,Trump Launches Official Watches—Pay with Bitcoin or $TRUMP
2025-01-30,Indiana Moves to Allow Bitcoin in Pension Funds as States Eye Crypto Reserves
2025-01-30,"Trump and Melania memecoins make push for real-world payments in fragrances, sneakers and travel"
2025-01-30,Illinois and Indiana Push for Bitcoin Reserves in New Bills
2025-01-30,Trump’s Order Sparks Bitcoin Boom: $200K Prediction for 2025
2025-01-29,Texas Lt. Governor announces ‘Bitcoin Reserve’ as priority bill for 2025
2025-01-29,Trump Media Launches Truth.Fi to Invest in Crypto and FinTech
2025-01-29,"Trump’s media company launches Truth.Fi, a fintech with crypto ambitions"
2025-01-29," BREAKING: Head of the Czech central bank wants to buy BILLIONS of dollars in Bitcoin. 

The central bank head is pushing to invest 5% of the nation’s $146b reserves into Bitcoin."
2025-01-29,Czech Central Bank Considers Billions in Bitcoin Reserves
2025-01-28,"Cboe Pushes SEC for In-Kind Bitcoin, Ethereum ETF Changes"
2025-01-27,Ripple CEO Brad Garlinghouse pokes at Bitcoiners – ‘Slow weekend…’
2025-01-27,"Breaking : MicroStrategy Buys 10,107 Bitcoin For $1.1 Billion"
2025-01-27,"Bitcoin retreats below $100,000, causing $850 million in crypto liquidations over past day"
2025-01-26,"Dogecoin Appears Poised For Explosive 10,000%  Gain – Analyst"
2025-01-26,Bullish chart pattern hints XRP to hit $9
2025-01-26,Ripple [XRP] caught in the fire as U.S. digital reserve plan divides community
2025-01-24,Will XRP Join Bitcoin in Trump’s US Strategic Crypto Reserve?
2025-01-24,"Bank Of America CEO Signals BTC, XRP Adoption as Trump Assumes Office"
2025-01-24,Ripple scores victory against the Bitcoin Strategic Reserve
2025-01-24,Michael Saylor celebrates ‘The Crypto Renaissance’ under Trump’s executive order
2025-01-24,Ripple CEO’s Comments on U.S. Accumulating XRP Sparks Speculations
2025-01-24,SEC Eases Rules for Banks to Safely Hold Bitcoin and Crypto
2025-01-24,Coinbase CEO Urges Governments to Hold Bitcoin as Strategic Reserve
2025-01-23,SEC Revokes SAB 121 Policy Allowing Banks to Custody Crypto
2025-01-23,"Yesterday Bank of America’s CEO said Wall Street is ready to “come in hard” for Bitcoin and crypto if the regulators allow them.

The regulator just gave the green light! 

🟢🟢🟢"
2025-01-23,President Trump signs an executive order for a national Bitcoin strategic reserve
2025-01-23,"Ethereum Aims to Position ETH as the Cryptocurrency for Wall Street, According to Bloomberg"
2025-01-23,"BREAKING: 🇺🇸Senator Lummis picked to chair the Senate Banking Subcommittee on Digital Assets.

‼️She wants to ""urgently pass"" legislation for a Bitcoin Strategic Reserve!"
2025-01-22,"BlackRock CEO Says Bitcoin Could Reach $700,000 Amid Economic Instability"
2025-01-22,Breaking: President Trump pardons Silk Road mastermind Ross Ulbricht
2025-01-21,El Salvador buys another 12 Bitcoin for country’s reserve despite IMF deal
2025-01-20,"Will Ethereum Price Rally Past $7,000? Experts Point To This Bullish Pattern"
2025-01-20,🇺🇸 BREAKING: Trump appoints pro-Bitcoin Mark Uyeda to replace Gary Gensler as Chair of the SEC
2025-01-20,Bitcoin Hits New ATH
2025-01-20,Bitcoin Price Hit A New All-time High!
2025-01-20,Trump crypto project buys $48M ETH as token strengthens vs Bitcoin
2025-01-17,Crypto Trading Volumes on Centralized Exchanges Reached Record $11.3 Trillion in December
2025-01-17,People Who Hold Bitcoin Will Be The RICHEST People On Earth PAY ATTENTION OR GET LEFT BEHIND
2025-01-17,"$3B in Bitcoin, Ethereum Options Expire as Trump Era Begins"
2025-01-16,XRP Witnesses Epic Breakout Versus Bitcoin and Ethereum
2025-01-16,Trump reportedly ‘receptive’ to strategic reserve with US-based cryptos
2025-01-15,XRP Surges as Wider Crypto Market Remains Flat. Why is it Up Today?
2025-01-15,Bitcoin inflows under Trump spark new $249K BTC price target for 2025
2025-01-15,Thailand considers approving Bitcoin ETFs
2025-01-14,Italy’s largest bank enters crypto market with $1M Bitcoin investment
2025-01-14,JPMorgan Issues Major Solana and XRP ETF Predictions: Details
2025-01-14,Stablecoins make up one-third of all crypto payments in 2024 – CoinGate report
2025-01-14,"XRP eyes $100 this cycle if historical pattern plays out, according to technical analyst"
2025-01-14,#Bitcoin and other #crypto prices will shoot upward as traditional banks integrate crypto into their services
2025-01-14,JUST IN: 🇸🇻 El Salvador’s President Bukele commits to installing a Bitcoin node in every home - Max Keiser
2025-01-13,Crypto ETFs to Boom in 2025: 50 Launches Predicted
2025-01-13,"Enormous XRP Breakout to Launch Skyrocketing Rally, Shiba Inu (SHIB): Pattern You Don't Avoid, Bitcoin (BTC) Still Sleeping"
2025-01-12,"Bitcoin (BTC USD): Analyst Predicts Bull Pennant Breakout, Targeting $140,000"
2025-01-11,New Hampshire and North Dakota Push for Bitcoin Reserves in State Funds
2025-01-10,Bitcoin USD Falls to $92K as Indicators Point to Increasing Demand
2025-01-09,Prepare To Become Richer THAN YOU EVER IMAGINED Bitcoin Is Almost GONE For Normal People
2025-01-09,Donald Trump Launches NFT Collection on Bitcoin Ordinals
2025-01-09,"U.S. DOJ Approved to Sell 69,370 Bitcoin, Sparking a Crypto Crash"
2025-01-08,"XRP ETF likely to launch after Bitcoin and Ether ETFs, says Ripple President"
2025-01-07,"Andrew Tate Launches BRUV Party, Eyes Bitcoin Reserve"
2025-01-06,"Cardano's Price Might Reclaim $1.20 in Days, Here's Why"
2025-01-05,Cardano’s 2025 Strategy: Wallet Innovation and Bitcoin Collaboration
2025-01-04,From $2 to $11: Popular Analyst Maps Out Ripple’s (XRP) Next Big Move
2025-01-03,Michael Saylor Predicts $280 Trillion Market Value for Bitcoin by 2045
2025-01-01,"XRP Trading Volume Soars in South Korea, Surpassing Bitcoin and Ethereum"
2025-01-01,Michael Saylor was wrong about Ethereum; There is a ‘second best’
2024-12-31,"Bitcoin Bearish Flag Pattern Says Crash Is Far From Over Despite Crash To $91,000"
2024-12-31,"Ethereum Edges Out Bitcoin in Long-Term Investor Retention, Data Shows"
2024-12-31,"Tether Buys $705M Bitcoin, Expands Strategic Reserves"
2024-12-31,Ethereum Predicted To Outperform Bitcoin By 2025: Steno Research
2024-12-31,MicroStrategy Buys $209M in Bitcoin Before Year-End
2024-12-30,Bitcoin spot ETFs shed $388M in weekly outflows while Ethereum ETFs gain $349M
2024-12-30,"Michael Saylor Hints at New MicroStrategy Bitcoin Purchase, Sparking Speculation"
2024-12-26,"KULR Technology purchases 217.18 Bitcoin for $21 Million, launches Bitcoin Treasury"
2024-12-26,"XRP Has Most Bullish-Looking Chart in Entire Crypto Space, According to Analyst – Here’s Why"
2024-12-25,FBI Links $308M DMM Bitcoin Hack to North Korea’s TraderTraitor Group
2024-12-25,"Bitcoin ETFs Face $1.2B Outflows, Ethereum Sees $130M Inflows"
2024-12-24,Saylor Proposes $81T Bitcoin Reserve Plan for US
2024-12-24,BRACE YOURSELF: FULL BLOWN Bitcoin Mania Is Coming And NO ONE Is Ready For THIS BTC Prediction
2024-12-23,Michael Saylor Urges Jeff Bezos to Invest in Bitcoin
2024-12-23,UAE Rumored to Hold $40 Billion in Bitcoin
2024-12-21,Michael Saylor Pushes Bitcoin Plan to Boost US Economy
2024-12-20,"Ether ETFs poised to surge in 2025, analysts say"
2024-12-20,Bitcoin and Ethereum Face $2.6B Options Expiry
2024-12-20,"SEC Approves First Hybrid Bitcoin-Ethereum ETFs From Hashdex, Franklin Templeton"
2024-12-19,"Bollinger Bands point to explosive Bitcoin price upside, but how high?"
2024-12-19,MicroStrategy May Pause Bitcoin Buys Amid Blackout Rumors
2024-12-18,"JUST IN: 🇭🇰 Hong Kong approves four more Bitcoin and crypto exchanges.

China is coming next..."
